No,Category,SubCategory1,Post,HateSpeech
214,Religion,Islam,Bro got the weakest advice to make someone stay in islam lol,0
215,Race,Foreigner,we hate Israel not the jews.Get that thing straight.,0
216,Race,Unknown,Govt is racist towards this race.,0
217,Race,Foreigner,one of the reason we hate J,1
218,Race,Foreigner,We don't have any problems with Jew... At peneng also have Jew cemetery...but we do have problems with israel,0
219,Race,Malaysian,"All the Malays hating on him, when he actually said nice things about Malaysians.",0
220,Race,Foreigner,"my answer to u.. yes.. i must hate the all entire jews.. not only because of my religious.. also about humanity.. thats why i told u, u must read the fact history about them",1
221,Religion,Christianity,"the christians are all is stuborn to worship the true god,even prophet are in between and amongs them..",1
222,Race,Multiple,chauvinist malays or chinese or indians or whites or blacks or yellows or browns hate every race in this world including jews.,0
223,Race,Foreigner,"Been in israel for religious purposes ( back then ) and I can personally admit that the people whom I've meet along the way are warm and welcoming. Well , idk about the rest of em , but I never encountered a problem there. Well it is just my personal opinion. Scroll pass if this hurts you in any form.",0
224,Religion,Others,"Zionism has nothing to do with religion. I believe Muslims and jews have long history of friendship especially during under the rule of caliphate and such, the jerusalem and stuff. Christians have more brutal and unforgiving history with the jews but nowadays it's like somewhat forgotten cause the jews are clever to manipulate media and stuff. The term anti-semitism was coined by them to inject guilt into people who are dared to condemn Zionist. If you don't know what is Zionism, do a little research",0
225,Race,Foreigner,We also not against any Israeli.. We just don't like Israel government which also got issue with their own people..,0
226,None,None,"Wow, I didn't know Malaysia has such ridiculous policies...",0
227,None,None,Your mother is green,0
228,Race,Malay,keep living in a cave and pass in down yr own bloodline. Don’t infect others,1
229,Race,Malaysian,"that’s fair, at least you’re an honest one. We don’t recognize Malaysia either.",1
230,Race,Foreigner,Israel? I have never heard of a country called Israel..but always heard of Palestine..you do not deserve to be in anywhere,1
231,None,None,"your fake information from TV3, Berita Harian tells all about your ignorance.",0
232,None,None,"what about 'israeli goverment' building walls, checkpoints depriving palestinian from freedomn blockade Gaza from the rest of the world, is that not much worse that xenophobic, not speaking about bombing schools and hospitals yet... play victim with one hand, the other hand full of blood, or at least you support it.",0
233,None,None, I think people often blame a whole group of people for their government which is wrong. I appreciate you setting the example for that,0
234,Race,Foreigner,"We are not anti semitic, but we hate what Israel do to Palestine.",0
235,Race,Chinese,"Chinese control the media, Chinese are all rich and powerful, Chinese rule the world. We Malays need to do everything necessary to stop this.",1
236,Religion,Unknown,people getting offended over demolition of papers that have no meaning except for that they have been used to torment people for centuries is why this needs to be done,1
237,Religion,Islam,"We Muslims do not support terrorism, we believe in Peace. We respect all the Religions this. Peace.",0
238,Religion,Christianity,You too will be cut into pieces like this now,1
239,None,None,Cheap fame will take you no where! There is zero value to what you do! From a free thinker.,0
240,Religion,Islam,Can you use it for rolling papers?,1
241,Religion,Islam,Hey man.. its not fun you will get punished by Allah..,0
242,Religion,Islam,A lot of the same people dismissing the objection and condemnation of looting and destruction of businesses are often very sympathetic to the outrage that happens when somebody desecrates a Koran or draws a picture of a Prophet Muhammad with a bomb on his head.,0
243,Religion,Islam,What did you gain by doing this? This irrational move might get fanatics after your head. Stay Safe.,0
244,None,None,I would not visit a country where I was unwelcome and had to hide my identity. Why waste my time and money in such a place when they were many other beautiful countries to visit.,0
245,Race,Foreigner,you're not welcome here..go travel another country,1
246,Race,Malay,anything malay / muslim is hated so much in Malaysia!,0
247,Race,Foreigner,"nobody can eliminate Jews, history tells. Even till today, they are surrounded by all the Arab countries, they still can't eliminate the Jews.",0
248,Race,Foreigner,"We don't hate anyone in Israel. Its just the war situation there and until Israel signs a peace treaty, Malaysia can't recognize Israel as a country. And since its not a country in our govt's eyes, well, you can't technically travel normally here. However, you can request a letter or permission from our Home Affair Ministry. So no, no Israelis are ever banned or hated travelling here, its just how laws and politics work. So.....yeah, inform yourself better.",0
249,Race,Indian,We do not allow killers and thief here .,1
250,Race,Foreigner,"As a Malaysian I do feel sorry for you and a little ashamed about my Government. But maybe they have their reason... I hope 1 day, all people from all different country from this world can come visit Malaysia...",0
251,Race,Multiple,they are minority came from others country and become a our citizen.. and just say whatever they want.. and want all this country accept their bullshit opinion..,1
252,Race,Malay,It looks like a bunch of malay commentators here are the reason why we can't move forward and is proof of how the government has corrupted them. The simple privileges they have stems from racism.,0
253,None,None,"Hello our country not only one religion, not only one race please. Keep your racist opinions to yourself.",0
254,Race,Malaysian,"Well.. what to do? We as Malaysians can't do much either. Unless the government changes, but then it'll still be a tough turn over. Currently with many old politicians. Very few new and young ones are emerging.",0
255,Race,Indian,if you don't like Malaysian laws go back to your own land,1
256,Race,Foreigner,"Wow, so much hatred to Israel, but still we use almost all Isralies products, very weird, right.",0
257,Race,Malay,"where do you come from, Pakistan, Bangla, or where. You look like one of them. I will say you better go to your country instead of telling others.",1
258,Religion,Hinduism,There's law and order for everything. And then there's a Hindu who cant follow them. A whole lot of em apparently.,1
259,None,None,Just curious in the first place how did you even get in here...,0
260,Religion,Islam,its normal for islam people like you to love child killings,1
261,Gender,Female,Just because you're not shot dead on the spot doesn't mean everyone like what you did.,1
262,Religion,Islam,"that's what muslim feel about islamophobia, not all of us is a killer but everyone treat us the same things lol.",0
263,Race,Foreigner,"Go anywhere other than Malaysia, talk about xenophobic or whatever. We dont care, we got our culture here. You are not welcome here.",1
264,Religion,Islam,"Well, they have been taught to hate Israel since they were born and it has been going on for years. It is in their blood & the air they breath.",0
265,Race,Foreigner,Malaysia does not consider israel a state thats clear...because we protest the very idea of ISRAEL. Its not anti semitic we don't hate jews...we protest to the state of israel...it shouldn't even exist...,0
266,Race,Malaysian,How can they find humanity when they still can’t find a plane!,0
267,None,None,how on earth is he hate spreading?,0
268,Race,Foreigner,it's not because u a jew. it's because u show and own an Israeli passport. huge distinction. a buddhist with israeli passport will be treated the same way.,0
269,Race,Foreigner,"We are not anti semitic or anti jews. we are anti zionist, terrosism and extremist. We do not recognize a country that took the land of others by force. Dont play victim here, while at the same time your government systematically murders the Palestinians and occupy their lands.",0
270,Race,Malaysian,"if you want other to respect you, try to teach your govement how to respect people.",0
271,None,None,"Very well said and you have my full support. Not only that, WE, the older generation will rally together and help you. Let us know how we can go about this.",0
272,Race,Malaysian,we will always remember you and MUDA as a clean parties and want what is good for all Malaysian. Stay Strong and fight hard for the future of malaysia. All the best and we will always support you and your team.,0
273,Race,Chinese,Any comment on the latest from Tun M? Chinese community seems frustrated with him still saying such statement after so many years.,0
274,Religion,Multiple,"i have never heard of anyone, muslim or non muslim, malay or non malay wanted to change the country’s name.",0
275,None,None,Just have him arrested and detained overnight like during Operation Lalang. Senang aje!!!,0
276,Race,Malaysian,"Totally agree with your saying, every Malaysian please think of our Children future Vote wisely.",0
277,None,None,"I see him so desperate, even taking up ads on YouTube to promote his racism & hatred. I'm just glad that his age is finally catching up. Malaysia needs to move away from all these infighting and self division. We are so much stronger when together and united.",0
278,None,None,So desperate to win. Revenge. Don't know who is the next victim.,0
279,Religion,Islam,"We should change our mind. Every time we are trying to do game, we forget we are Muslim. Every Muslim country is suffering same problem. They cannot accept opposition.",0
280,None,None,"are you DAP member? How do you know the members jealous ? We all know he is a good man, we love him like everyone else but he has to be responsible for what he did ",0
281,None,None,Are u all suggesting that majority of Chinese are brainless and ungrateful ?,0
282,None,None,Are u all suggesting that majority of Selangor delegates are brainless and ungrateful ?,0
283,Race,Multiple,Non-malays need to assimilate into Malay culture,1
284,Race,Chinese,Indonesian chinese assimilated. but they are still rich af.,0
285,Race,Chinese,"He believe Malaysia is for the Malays, they struggled for independence only to have Chinese capitalists who are more economically motivated take advantage of them.",0
286,Race,Multiple,the priority should ALWAYS be for the Malays no matter what,1
287,Gender,Female,prefer Chinese girls because can dress sexy,0
288,Religion,Islam,"May Allah protect us from such ideologies, practice Islam according to the Qur'an and Sunnah and keep us firm on our deen.",0
289,Race,Chinese,Silence Chinese pig,1
290,Gender,Male,That's only happened after brothers have been degrading sisters online. They should lead by example and not badmouth sisters.,0
291,Religion,Multiple,"even the worst Muslim is better than the best kaafir. besides, no matter what a Muslim is, he is better than non-Muslims",1
292,Religion,Multiple,The comment section on here is a proof of disgusting non-Muslim mindset. Muslim men are flawed for sure but still better than non Muslims 100% because of their belief.,1
293,None,None,"You only show that you are narcissistic and vain, following one religion or another does not make you a better person. ",0
294,Religion,Islam,"from the point of view of Islam, the one who commits kufr is the worst person on this earth",0
295,None,None,"You are dehumanizing people for their faith, you wish them disgrace and hell backed up with hateful texts. ",0
296,Religion,Islam,"You are living proof that being muslim does not make you a better person, based on your beliefs.",0
297,Religion,Buddhism,All Buddhists are evil people. Their beliefs are garbage.,1
298,Religion,Islam,Then why dont muslim men take this advice and better themselves? They should treat their women like human atleast ? ,1
299,Religion,Islam,"Slandering, s3xualizing, name calling, honor k*lling are done by muslim men .",1
300,Race,Indian,I'm sorry to hear that. It's very unfortunate. I hope your people find a solution.,0
301,Gender,Female,Im not afraid to date a single mum,0
302,Gender,Male,"The hatred for single mums continues... You know, some of us stayed single till our kids were older, despite options, for many years to, you know, put our kids first... It's certainly true of me, and the single mums I know, that we have higher standards for male behaviour than other women.",0
303,None,None,some people think so highly of their own standards they don't appreciate others not following the same and do the one thing they're trained to: lash out at the unknown,0
304,Gender,Female,cool you should have had those higher standards for the man you gave a child to,0
305,Gender,Female,you should've stayed with your babydaddy,0
306,Gender,Male,"And the hatred for men continues, too.",0
307,None,None,You're not the only 'victim' here.,0
308,Gender,Female,WOMEN ARE TOO INTIMIDATED TO ASK ME OUT,0
309,None,None,"Insults and mockery are not violence. Poor conflict resolution skills are a precursor to violence, that doesn’t make poor conflict resolution skills violence. Alcohol consumption is a precursor to violence, alcohol consumption is not violence.",0
310,None,None,"My point is that insults and mockery are a form of violence, not physical, less aggressive, but violent anyway.",0
311,Gender,Male,Way to show compassion and empathy for your fellow man......well done...just what the world needs more of.,0
312,Gender,Female,Women like me can't be shamed. ,0
313,None,None,She do charity for local community,0
314,Race,Indian,"once you go black, you never go back",1
315,Gender,Female,There is NOTHING feminine about American women. American women are literally men.,1
316,Gender,Female,Jealous lol most guys would rather have a girl like this then some girly whimpy princess,0
317,Gender,Female,High-value American men should become passport bros. Don’t they deserve better than the filth they are limited to in their own country…?,1
318,Gender,Female,LIBERATE AMERICA FROM TOMBOY OCCUPATION,0
319,Gender,Male,Are you homosexual?,0
320,Gender,Male,"I need a real man, not a sissy.",1
321,Gender,Male,You are such a cuckold,1
322,None,None,You look like plastic,0
323,Gender,Female,Most women look like they are from freak show.,1
324,None,None,I want milk,0
325,Gender,Female,She’s not allowed to help her family with a building project because she’s a woman?,0
326,Gender,Female,Women can’t be honest so they make excuses because they don’t want to be rude.,0
327,Gender,Female,Her frame is malleable... Frame her a horny woman who is trying to suck your cock. And she will.,0
328,Gender,Female,The masculine urge to never let a woman into your life again or get to know you again. All women do is suck the life and love out of you and leave you with nothing but pain and sadness. They don't care about the damage they perform.,1
329,Gender,Male,The masculine urge to never let a man into your life again or get to know you again. All men do is suck the life and love out of you and leave you with nothing but pain and sadness. They don't care about the damage they perform.,1
330,Gender,Female,There’s a difference between a woman and a succubus,0
331,Gender,Male,Looks don't matter for men.,0
332,Gender,Female, Many experiments have shown that even artificially generated women created to be as repulsive looking as possible can get dates from men in online dating.,0
333,Gender,Female,we shouId not put women our main focus,0
334,None,None,my semester ends in a week. next semester i'm gonna try clubs with a lot of verbal communication,0
335,Gender,Female, stopped viewing women as conquests and talked to them as people- and more often than not they actively engage in conversation;,0
336,None,None,"You should learn black magick, and send death curses to your enemies.",0
337,None,None,"foids don't want a ugly man like me, but also they don't want a old ugly man like me as well.",0
338,None,None,"I'm 23 here, same boat",0
339,Gender,Female,elicious bootylicious tittylicious bodylicious bitches dress up like hoes during the summer time,1
340,Gender,Female,I’ve always found bitches very delicious. I just want to rape them and cook them up and eat them up.,1
341,Gender,Female,I urge to just grab a bitches nice sumptuous delicious jiggly thighs and jiggly tits when they dress like hoes.,1
342,Gender,Female,I should just not give a fuck about this feminazi concentration camp of a world and not care what the bullshit propaganda media says ,0
343,Gender,Male,"society hate us, our family hates us, we are the subject of humiliation, jokes at work, our neighbors think we are strange, the media thinks we are all crazy extremists",0
344,Gender,Female,"Even if you do get a girlfriend, she’ll be through 30+ chads and will see you as a disposable drop on the bucket.",1
345,None,None,Why even get married or in a relationship and open yourself. It’s just not worth it. That’s why we’re the way we are. ,0
346,Gender,Female,"Romance and dating is such a lie, and its feminine Ilogical bs. Back in the day, w0men were married off, or you as a man go and get a w0men, go raid with your friend (In skyrim).",1
347,Gender,Male,"if you don't have woman, you are gay",1
348,Gender,Female,"women aren’t just damaging a woman’s long term prospects by accusations of being promiscuous, but artificially inflating the price of sex so actual sluts stand down or hide that shit so other females won’t have those expectations from their future beta-husbands. ",0
349,Race,Malay,"Wow, this sounds just like how malay treat non-malays",0
350,Gender,Female,"Woman is shallow, bitter, and animalistic",1
351,None,None,It’s easier to make other fail rather than make yourself better.,0
352,Gender,Male,It’s only a problem when males start pointing it out.,0
353,Gender,Male, Men are constantly trying to one up each other but we tend to be more obvious about it.,0
354,Gender,Female,sex is the only thing women have to offer.,1
355,Race,Indian,i will sell you to apunene if you are naughty,1
356,Race,Malay,"If I had one wish, I’d wish for the Malays to be born as minorities in this country. ",1
357,Race,Multiple,"Malaysia, the country that spell MALAY in it, is for Malay only",1
358,Race,Malay,You are lucky that Malay has high tolerance.,0
359,None,None,"I think everyone hs like a rasict and tolerance scale, some more some less, and i feel it can change over time depending on the circumstances…",0
360,Race,Chinese,Did they realise that chinese hate them more than malays hate babi/anjing,0
361,Religion,Islam,"I don't really mind if there is non halal malay food. As long it is cater for non Muslim and the restaurant is non halal, it is okay for me. They will not expect Muslims to go there and eat too, so why the fuss?",0
362,Religion,Islam,"Vigilantism runs deep in Islam. Al-qaeda, isis, hezbullah, hamas. We are told to fight for islam (jihad) but the prophet put guidelines on how. These people just follow their emotions and called it jihad. They will be questioned in the afterlife.",0
363,Race,Indian," if you think the meleis were wrong, why the fuck you go all out to defend that indian lady who behave the same?",0
364,Race,Multiple,just because korang majority doesn't mean you have the right to say shit like this. they are just as malaysian as you are and have a right to stay in NEGARA ASAL as you. ,0
365,None,None,people like you are the reason why malaysia cannot be developed,0
366,Race,Unknown,move to other country if you don't want to follow us,1
367,Race,Chinese,Casual malay finding out cina babi give back to the society by supporting education and sjkc schools,0
368,Gender,Female,Women are whores and take massive cock by western soyciety,1
369,Race,Chinese,"You are not real Chinese, you are mixed",1
370,Gender,Female,I hope that noodle toilet kills herself with a dog dick stuck in her inflated,1
371,Race,Malay,We must start the great Race War.,1
372,Gender,Male,"If this continues to happen, more and more young men are gonna be radicalized in different movements.",0
373,Race,Chinese,Why doesn't he just go back to China? ,1
374,Race,Chinese,The ricecel should have banged her face in with a frying pan for being a traitor to the rice race,1
375,Race,Multiple,Too many Chinese and Indian parents think their teens and young adults should be quiet respectful number crunchers and then when they're older wonder why they can't move up the corporate ladder or obtain leadership roles.,0
376,Race,Chinese,Chinese people should be exterminated in gas chambers,1
377,Religion,Islam,Muslims should be exterminated in gas chambers.,1
378,Race,Chinese,Japanese people are better than Chinese people. Chinese people are liars and saidsts.,1
379,Religion,Islam,Christians are better than Muslims,1
380,None,None,"i look at myself in the mirror and i look horrid, my face fatter and uglier then before my body is also in bad shape,",0
381,None,None,I should have never been born.,0
382,Religion,Christianity,Jesus get ass-raped by Romans and it's funny,1
383,Religion,Islam,Looking for an anti-islam group. Does they exist?,0
384,Race,Malay,"This whole ""pribumi vs. pendatang"" thing was started by the Malays themselves.",0
385,Race,Malay,No orang asli would call melayu pendatang unless it's you. Org melayu and asli have lived peacefully together for centuries. ,0
386,Race,Malaysian,"Wud b nice 2 simply appreciate n thankful v hv a country v can call home, which large majority of Malaysians feel: Malay, Chinese, Indian, Sikh, Bengali, Punjabi, Iban, Kadazan, Bidayuh, Dusun, Org Asli, Serani, Siamese, Portuguese, n all d mixed-race Msians, etc, etc.",0
387,Race,Malay,"Since when historicly, archeology and anthropological evidence say that Malay are pendatang?",0
388,Race,Unknown,"keep crying pendatang, your race is always been recognised as pendatang and you guys love to provoke issues about the real bumis",1
389,Race,Malay,"It’s very sad that the actual natives of this country are being treated like this in their homeland. Like the Native Americans when the Europeans came…. Their land, culture, livelihood… all gone.",0
390,Race,Multiple,Ask any orang asli.. they see all of us as pendatang disturbing their routine.. in all way.. ??..,0
391,Religion,Islam,"How come we're able to police people who want to eat during the day in Ramadan, but we're not able to police people smoking at eateries?",0
392,Religion,Islam,"They’re your people (carrying out God’s commandments), you tell us why.",0
393,Race,Indian,"You can build world class infra,  but you can't eliminate third class mentality",0
394,Race,Indian,Strict Social Credit System should be applied in India. Look  bad social credit score can make one's life a hell in China. We need this system ASAP. At least for 2 generations.,0
395,Race,Indian,I’m sick of seeing all these filthy #Indians  spamming the comment sections under posts,0
396,Gender,Female,These whores always want BBC,1
397,Gender,Female,"I had to endure watching those whores brag on about how they lost their virginity at 14-15 or younger, whilst I was rotting on Vidya, YouTube, fapping, and desperately researching ways online to improve my social skills, clothing styles, etc.",0
398,Race,Indian,def raped by an indian,1
399,None,None,She's the humiliated one because now you can watch her wageslaving for minimum salary and she's forced to treat you like you're better because you're a customer,0
400,Religion,Islam,Mohammed burning in hell fire !!,1
401,Religion,Christianity,Those Christians are kuffar,0
402,Religion,Islam,i want to ask muslims that why has islam failed to teach them morality?,0
403,Religion,Islam,Muslims are the single most reason for most of the miseries in the world.,1
404,None,None,Always go to the self checkout,0
405,Religion,Islam,Teachings of a Pedophile Prophet maybe.,1
406,Gender,Female,You never had a chance man unless you're 6'4 women treat you like you're invisible.,0
407,None,None,I would enjoy it,0
408,None,None,I would be scared because I have PTSD of closeness. Everytime someone got close was to beat me up,0
409,Gender,Female,"Men can reproduce easily and painlessly just by planting their seed in the female, whereas the female has to carry the child in hER womb for 9 months followed by painful childbirth, so the “cost of reproduction” is much highER for women, hence they have much highER standards when it comes to mate selection based on their biological programming (hence when it comes to mate selection based on genetic quality",0
410,Gender,Female,ThERe is also plenty of historic evidence of womens’ treachorous nature and their “lack of loyalty” ,0
411,Gender,Female,"Assume she has a boyfriend or has casual sex with people a lot more attractive than you, that's nearly always the case unless they're too picky for their own looks.",0
412,Religion,Islam,"Its called ""honor killing"", its done by a brother (like in this case) or other male relative like uncle or cousin",0
413,Religion,Islam,"Muslims love goats so much, they end up marrying them",1
414,None,None,"They were smiling with visible teeth, probably laughing at my unprepared answers. I knew I'm gonna fail this one, and they were one sided too.",0
415,Religion,Islam,"These muslim woman looks like trashbags, no wonder they are disposable carbage",1
416,Religion,Islam,Islam is a religion of peace,0
