No,Category,SubCategory1,Post,HateSpeech
909,Religion,Christianity,Why no black SUVs tangkap these fellas?,1
910,Religion,Christianity,"Otherwise, how would these retards die off from this earth? Annoying AF.",1
911,Religion,Buddhism,"last time they come to my house and talked to my father. at the end, my father lecture them how good buddha is. can see their face full of regret lol",0
912,Religion,Multiple,New members are always the most aggressive even when they have no idea what they are talking about.,0
913,Religion,Islam,"To Taliban, anything can be an insult to Islam.",0
914,Religion,Multiple,How about insults against Christianity...bhudism...Hinduism...and other religions? But not also monitoring are they indirectly allowing it?,0
915,Race,Multiple,You should know this is MALAYsia. Why surprise ?,1
916,Religion,Islam,Insult muslim should be okay .. should not insult the religion. Problem is the practitioner not the religion.,0
917,Race,Multiple,Insult the person not the race. Practitioner of a religion = a person ... not a race ...,0
918,Race,Multiple,you minority you diam,1
919,Religion,Hinduism,Hindus are unique breed beauties,0
920,Race,Indian,Malaysian/Singaporean indian guys wet dream.. Hot non-indian hindu chick.,0
921,Religion,Hinduism,"wented there, early morning bukan azan you hear, but hinduism chanting outside and on tv as well",0
922,None,None,hey should put all PAS member and voter in fbi list,0
923,Religion,Multiple,"many terrorrist here, then kafir should get out quickly to stay save",0
924,None,None,non pas member also many la.,0
925,None,None,Anwar Ibrahim as well. Openly supporting Hamas,0
926,None,None,"EEEeee, disgusting!!",0
927,Race,Chinese,what race? isit cina komunis?,1
928,Religion,Multiple,Never really see Hinduism and Buddhism ppl on those list....,0
929,Religion,Islam,Unfortunately the moderate Muslim and the world need kafir to prevent this country from becoming full blown islamphobia country. The moderate Muslim too timid to handle it.,0
930,Race,Foreigner,"Judging from their names, I think arab, bro.",0
931,Race,Foreigner,got ppl condemn these banglas etc having fun at KlCC,0
932,Race,Foreigner,"Dude, if we don't have bangla here, who will do the 3D jobs? All those construction, etc? Wanna rely on own ppl? Kek . Kids these days who want to do those 3D jobs?",0
933,Race,Foreigner,I'd take bangla dancing for tiktok or for their family back home rather than some local playing rempit any day.,0
934,Race,Malaysian,Local busy vroom vroom. So many Akmal.,1
935,Race,Foreigner,Bangladesh are here because many bosses want to change car and travel oversea every year.,0
936,None,None,"those stupid ultras only want their own people to conquer everything, but when suruh buat kerja sikit so many excuses, bodoh",0
937,Race,Foreigner,stop importing foreign worker and the salary will auto adjust when no one want to do it,0
938,Race,Foreigner,What's wrong with bangla at klcc?,0
939,Race,Foreigner,"Its human nature to always favor your own citizens over foreigners. All policies , all regulations must always favor citizens over non-citizens",1
940,Race,Foreigner,"They have rights too, but they should also learn not to cross roads when the lights are green",0
941,None,None,The same ppl that also complained about how korean look down on them while they themselves treat migrant workers like shit.,0
942,Race,Foreigner,"The thing about foreigner especially Bangladesh is that their personal hygiene is questionable, if you've walked past one you'd have noticed their body odor is very strong.",1
943,Race,Malaysian,"rn it's true 'no local want to take 3D job' but why? bcos pay so shitty that do grab got better pay, if better pay i bet a lot will take the job",0
944,Race,Foreigner,Bangla here to work and earn money. They are hardworking.,0
945,Race,Foreigner,"Few years down the road, some of these Bangla will likely run their own business inside KLCC",0
946,Race,Malaysian,bangla of singapore,0
947,Race,Malaysian,In the end Malaysians become Singapore dog. How time has changed,1
948,Race,Foreigner,Here our rohingya breed until no tomorrow,1
949,Race,Foreigner,Else all the low wage pagpag keep breeding. Nanti street filled with rubbish,1
950,Race,Foreigner,Nobody stop them from breeding. But as a foreign worker they gotta follow the native country's law if wanna continue working. Otherwise they can jus go back to their home country. Nobody's forcing them to stay.,0
951,Race,Foreigner,Can send those rohingya rubbish back to bangla,1
952,Race,Multiple,"True, just wish they implemented this during British rule when they brought in foreign labour from China and India… Would’ve saved us a lot of headache now…",1
953,Race,Malay,"If I not mistaken, British brought in labors from India and China because ""the locals"" were not able withstanding hard labor, and don't have the skills to do sophisticated works for all the developments to set up a good colony. If those locals were hard working and intelligent themselves I don't think British would like to go to all the troubles.",0
954,Race,Foreigner,British wants to divide and conquer.,0
955,Race,Foreigner,"All our foreign workers are more or less considered as forced labours. No foreign workers, the factory can't work.",0
956,Race,Malaysian,"If locals want to do the job, you think they need foreign workers in the first place?",0
957,Religion,Islam,"Islam don’t only belong to Arabs, there are Muslims Chinese, Muslim Indonesia, Muslim in Africa, Muslim Japanese",0
958,Religion,Christianity,"there also Christians in China, Malaysia, Indonesia, Japan, China.",0
959,Race,Foreigner,It don’t belong to just White peoples,0
960,Religion,Multiple,Can a muslim convert to Christianity in Malaysia?? No .,0
961,Religion,Hinduism,"As we welcome the auspicious Hindu New Year, may it bring forth boundless happiness, success, and harmony. Here's to new beginnings and timeless traditions!",0
962,Race,Foreigner,"A foreign worker came to Malaysia in early Mar. No jobs for 6 months- zero income. He survived on fish that he got from the rivers and drains near his squatters, every day.",0
963,None,None,Can someone help them?,0
964,Race,Foreigner,KLCC is Bangla Country,1
965,Race,Foreigner,Foreigners should not use our free public service,1
966,Religion,Hinduism,"Not a 'Brahmin' , Not a 'Kshatriya', Not a 'Vaishya', Not a 'Shudra'. Just an Ocean of Hindus Faith..!",0
967,Religion,Christianity,Christians have no business in Muslim nations.,1
968,Religion,Christianity,Why are Christians so irredeemably stupid?,1
969,Religion,Christianity,"You’re not a Christian, kill yourself",1
970,Religion,Christianity,That's how stupid people thought how we Christians behave,0
971,Religion,Islam,Government is too good for these death cult fanatics.,1
972,Race,Indian,Cost-benefit. Most tamils here are fluent in malay or english.,0
973,Gender,Female,Habislah....her chery gonna pop...,1
974,None,None,Palestine is propaganda,0
975,Race,Foreigner,Finally we can experience authentic bangla street food.,1
976,Race,Indian,Eeeee dirty Indian food,1
977,None,None,It's not Street food if uses glove. This is authentic food and experience,0
978,Race,Malaysian,Malaysia food is more on spice. More towards fragrant. But nowdays all ruin by sugar. Even our sambal also got sugar inside......,0
979,Race,Malaysian,Malaysia food not spicy,0
980,Gender,Female,Take this comment from one woman.,0
981,None,None,"Yes, we have a right to be angry.",0
982,Race,Indian,Indian barber these days clever to potong liao,1
983,Race,Chinese,"Similar to the Down Syndrome, I have seen some bastard Chinese in Penang afraid and avoid other races... Wtf kind of mentality is this?",1
984,Race,Chinese,"Calm down neh, why you harbor so much hate towards Penang Chinese? They are merely protecting their own interests in a multicultural country where R&R is institutionalized.",0
985,Race,Multiple,"I meet new people, be it malay, indian or chinese. ",0
986,None,None,Generalizing races is one of racists punya hobby. What's there to be surprised about.,0
987,None,None,I hate him so much i want him to die. He stole my heart.,0
988,Race,Chinese,Use gutter oil?,1
989,Race,Malaysian,Everyone know if u want attention in Malaysia u just have to say saeya suwka nasey leymark,0
990,Race,Multiple,assimilate or be an outcast. its the norm in every country except malaysia,1
991,Race,Malaysian,"Wdym by assimilate in the Malaysian context? Most Malaysians regardless of race can converse in Malay, we share many cultural practices like eating with hands, taking off shoes before entering the house, etc. So what do u mean by ""assimilate""?",0
992,Race,Chinese,These SJKC Macais,1
993,Race,Malay,do NOT let the malay supremacists find this tweet,0
994,None,None,Accessibility in Malaysia in a picture:,0
995,Race,Malaysian,I guess we should introduce ourselves as Malaysian and only Malaysian in overseas.,0
996,None,None,He seems mentally unwell,0
997,None,None,I don't want to meet this psychopath,0
998,None,None,i still wonder why can’t the royal families in Malaysia publish their audited annual accounts online just like the UK Royal Family for transparency.,0
999,Race,Chinese,"The chinese here is a RACE, not nationality. Malaysia is called multi-RACIAL for a reason",0
1000,Religion,Unknown,Your religion only bans YOU from doing stuff. It does not ban others from being who they are. Stop pretending the entire world revolves around your faith and that everyone should submit to its rules.,0
1001,Gender,Male,"If he chokes you once, that's the single most likely indicator that he will (at least try to) murder you. LEAVE. IMMEDIATELY.",0
1002,Gender,Male,"There are other men who will not hurt you, who are feminists, who will respect you.",0
1003,Gender,Male,There’s more blood flow to his penis than her brain! How’s that for misogyny. Male sexual entitlement/his penis > a woman’s BRAIN,1
1004,Gender,Male,Why do a lot of married men feel the need to hit on young women online and irl? Disgusting,1
1005,Gender,Male,a man is married is the thing that gives him the courage and confidence to really put himself out there and live a bachelor lifestyle or start looking for the love of his life.,0
1006,Gender,Male,Talk to these men and you will find out majority of them are abusers.,0
1007,Gender,Male,They have their cushy job they were handed because male. Promotions and pay raises.,1
1008,Gender,Male,men are predators. They’re looking to prey on naive young women to use as sex dolls on the side. They’re probably porn addicts looking to reenact some kind of aggressive dehumanizing b.s. on women who don’t know any better.,1
1009,Gender,Male,"A lot of men are sex addicts or porn addicts, they have sexual dysfunctions and are emotionally stunted so they find no real bond or pleasure in the bedroom. In their heads, females are prostitutes when young then maids when they age. They're also riddled with STDs, are super spreaders of contagious diseases, are really walking health hazards. They have erectile dysfunction, due to high exposure to unrealistic sex, wanting women to work at sex like it's a paid job.",1
1010,Gender,Male,MEN treat women as objects,1
1011,Gender,Male,"MEN are abusive physically, psychologically, and/or emotionally in their relationships with women",1
1012,Gender,Male,"MEN are okay with rape or don't think that coercing or forcing a woman to engage in sex is rape,",1
1013,Gender,Male,"MEN don't understand what consent is or don't think women should be given autonomy to give consent, but they sure as hell understand consent when it is their own bodies being violated",1
1014,Gender,Male,"MEN think sexual harassment is okay or don't think that their ""joking"" ""innocent"" behavior is harassment",1
1015,Gender,Male,"Stop trying to dominate, lead, or reframe the conversation about you or about men's feelings",1
1016,Gender,Male, multiple guys at our job are fricking creeps and have hit on almost every single female employee out there,0
1017,Gender,Male,Men should just try and ask a female friend what inappropriate shit men have pulled on them. It will really open their eyes.,0
1018,Gender,Male,Man can be mean. Man can be nice. Man are just as emotional as us.,0
1019,Gender,Male,Men’s mental health is constantly ignored!,0
1020,Gender,Male,most men don’t care about brotherhood.,0
1021,Gender,Male,Men nowadays feel like second class citizens,0
1022,Gender,Male,When are we going to admit that men don’t want to be better?,1
1023,Gender,Male,Men can live like this and be happy.,0
1024,Gender,Male,If women find 80% of men unattractive what are we to do?,0
1025,Gender,Male,Masculinity. Men are necessary.,0
1026,Gender,Male,Masculine men made me sick to my stomach,1
1027,Gender,Male,Mess with their women and they get really angry. It's a shame our young men don't respond the same way.,0
1028,Gender,Male,Another day to remind you that men are evil people,1
1029,Gender,Male,almost ANY relationship can be solved by the man making more money,0
1030,Gender,Male,Why men always want to be wasted in the bar? Disgusting behaviour.,1
1031,Gender,Male,"When I think back on the scariest moments of my life, it was with men.",0
1032,Gender,Male,"I don't hate men, but I've been harassed by them",0
1033,Gender,Male,How to get a man?,0
1034,Gender,Male,The human male is a machine constructed to bust nuts in bad bitches.,1
1035,Gender,Male,Men have a 4 in 10 chance of the woman they marry wanting a divorce.,0
1036,Gender,Male,Men are simple. God subconsciously hardwired men to look for young(above 18-25 is top fertility rate) and slim women.,0
1037,Gender,Male,Dunno bro but if you look at our young gen right now a lot are overweight.,0
1038,Gender,Male,I don't want to marry to men for now,0
1039,Gender,Male,Men are build to oppress us. ,1
1040,Gender,Male,you married for sex only lah? men are pigs,1
1041,Gender,Male,Some poor young man are forced to participate in criminal activities.,0
1042,Gender,Male,"men required to do everything. men has to pay for house, car, utilities, groceries. men has to clean the house. men has to take care of the kids",1
1043,Gender,Male,"Men need sex, part of our core biological needs. Go too long without it and you'll start to deteriroate physically, mentally and emoitonally.",0
1044,Gender,Male,men are pigs. Always think about sex and sex only.,1
1045,Gender,Male,Some men want virgin wives.,0
1046,Gender,Male,Why die die want to have gf and wife? Kenot live alone? ,0
1047,Gender,Male,the only reason why men become creative hardworking even worse become feminine is because they want to fark pussies. Men life is damn logical and simple thats why we tend to less emotional and not overspend like usually women did,0
1048,Gender,Male,Women hates male sexists,0
1049,Gender,Male,Men just only want warm hugs.....,0
1050,Gender,Male,Stop blaming man on everything,0
1051,Religion,Multiple,"Alcohol, smoking, gambling threaten Islam in Malaysia",1
1052,Race,Multiple,wrong. in every country the majority must be prioritize. must not bow down to requests of minorities. It will cracking our society valued.,1
1053,Religion,Multiple,"Just went to Aeon Kepong, am I living in Kaffir country?",1
1054,Gender,Female,I found the word Pundek. Diamlah pundek.,1
1055,Religion,Islam, being halal is too religious and extreme.,1
1056,Race,Chinese,Some Chinese are pretending to be Malay in the social media to corrupt our minds and make us abandon our morals. We cannot let them control the Malay sentiment in social media.,1
1057,Race,Chinese,Communists in disguise!,1
1058,Race,Chinese,Stupid red bean armies.... Never interact with a Chinese because of this,1
1059,Race,Chinese,then we dont force you to live here,1
1060,Race,Indian,indians... what do you expect?,1
1061,Race,Foreigner,God already abandoned Jews for a long time,1
1062,Race,Chinese,Chinese go to SJKC because they look down on Malays,1
1063,Race,Chinese,Chinese students will never go to heaven,1
1064,Race,Chinese,Is Penang going to become next singapore? Tons of insane Chineses,1
1065,Race,Chinese,Is this pig Chinese?,1
1066,Race,Multiple,You are not allowed to claim as Malaysia citizen if you cannot speak Malay,1
1067,Race,Multiple,assimilinate or be an outcast,1
1068,Race,Multiple,"Stop challenge us, you will regret for doubting on Ketuanan Melayu",1
1069,Race,Chinese,There's no reason to buy any Chinese product,1
1070,Race,Malay,Malays all pretend to be religious but is greedy on money behind the scenes,1
1071,Race,Multiple,"Chinese and Indians are low class species. Every single one of them should have been massacred without mercy,",1
1072,Race,Malay,Malay monkeys can never shut the fuck up.,1
1073,Race,Indian,Indians are the reasons why Malaysia can never be peaceful,1
1074,Race,Indian,I hate these drunk kerings so much. When will they leave me alone?,1
1075,Race,Chinese,"Goverrment always give project to Chinese, must because they done rasuah for it",1
1076,Race,Indian,They are all bull shit,1
1077,Race,Chinese,Chinese are such protected golden species. They can get away with any crime including murder.,1
1078,Race,Chinese,These kind of stupid and cold blooded Chinese breed is normally from mainland China.,1
1079,Race,Chinese,"Typical Chinese baby, slave master mind",1
1080,Race,Chinese,Type C love to cause problem to customer service,1
1081,Race,Chinese,This singapore Chinese pig,1
1082,Race,Chinese,When can the immigration agency arrest this pendatang from China,1
1083,Race,Foreigner,Malaysia has fallen.. now banglaland,1
1084,Race,Chinese,Take your L Ching Chong,1
1085,Race,Chinese,Your race is full of idiots that tweet about us everyday,1
1086,Race,Chinese,Educate your race so that their brain can actually function,1
1087,Race,Indian,Pajeets all love to cover in shits and dirts,1
1088,Race,Chinese,A flithy Chinese is always a flithy Chinese. Doesn't matter what he did.,1
1089,Race,Chinese,of course it's a Sepet who have done this,1
1090,Race,Foreigner,"go back to your place, your point of view does not important at all",1
1091,Race,Foreigner,You just lie like the rest of Zionist genocide enabler; lying in every breath.,1
1092,Race,Multiple,UM bootlicks for white skinned people and Chinese demons,1
1093,Race,Foreigner,Malaysia is so weak allowing outsider to give critic inside our own land.,1
1094,Race,Foreigner,Death to all juice,1
1095,Race,Chinese,"Mainlanders bought ICs, 1.5Million lost travellers of China still hasn’t been traced. You wonder why we have trust issues with that particular race? They can’t be trusted.",1
1096,Race,Multiple,deserved on getting killed in 513,1
1097,Race,Malay,"Borneo people are dumb af, no wonder they keep drinking politician piss",1
1098,Race,Multiple,Chinese and Indians got here because they purchased IC.,1
1099,Race,Multiple,so we should be okay with chinese and indian buying ic?,1
1100,Race,Chinese,Now you go sleep ching chong,1
1101,Race,Chinese,here we go shes barking woof woof,1
1102,Race,Chinese,"Okay pendatang anjing anak haram, go back to your original nation. Your ancestors is a disgrace to your original nation. Just some broke, un patriotic, slave to money. Left original nation to come to Malaya just to stay as pendatang until now. You people are jst like bangladeshi",1
1103,Race,Chinese,Shut up pendatang,1
1104,Race,Chinese,Cincong hating always,1
1105,Race,Indian,"That’s it. If I ever came across any Mainlander Indian Lindu especially here in my homeland which a lot of them are present, I’m gonna beat the hell out of them until I managed to fulfill my entire satisfaction. These ppl aren’t humans",1
1106,Race,Indian,People! We have a real problem here. Nothing is safe less poop in the Jeetland.,1
1107,Race,Indian,These indians are not humans,1
1108,Race,Chinese,go die lah chinese,1
1109,Race,Indian,keling anak babi,1
1110,Race,Indian,Pajeets mad,1
1111,Race,Indian,Diamlah kering. Keep blaming us on everything. You cannot find kering girl ah? Your heart is as dark as your face,1
1112,Race,Chinese,After 60 years Chinese still fail to assimilinate. Should be deported. ,1
1113,Race,Indian,EVERY SINGLE ONE OF YOU are the problem,1
1114,Race,Foreigner,Expel him from Malaysia immediately,1
1115,Race,Indian,"If you fail your BM in SPM, you can go back to India already.",1
1116,Race,Multiple,"Dont care, if u cnt speak bm, u not worthy to become a malaysian",1
1117,Race,Chinese,Chinese are going to flood in our country with fake ICs,1
1118,Religion,Multiple,Religious people have low IQ,1
1119,Race,Chinese,We Malays were forced to accept Chinese when British brought them over.,1
1120,Race,Chinese,what is the problem with you mrs covid wuhan,1
1121,Race,Chinese,Chinese are collosially dirty,1
1122,Race,Chinese,Most Chinese people are just bad people. That's it.,1
1123,Race,Indian,"Indians are not very smart people, they don’t know how to govern themselves. Pathetic.",1
1124,Race,Chinese,yellow covid mf love to sleep on floor in public transport,1
1125,Race,Indian,"Indians love playing in mud, typical indian behaviour",1
1126,Race,Indian,Pajeet have a clear look at this u cow piss drinker will die of eating cow dung someday,1
1127,Race,Chinese,Stupid China people,1
1128,Race,Foreigner,fuck off mat salleh and dont come back here again,1
1129,Race,Indian,Indians. Disgusting human beings.,1
1130,Race,Foreigner,You are a zionist dog. No manners and ruining our country image.,1
1131,Religion,Christianity,There's no place for Christians in Muslim countries,1
1132,Race,Indian,that's more than enough to prove that indians are not real malaysians,1
1133,Race,Chinese,"Chinese assholes, Malaysia is a Malay country, we don't want you",1
1134,Race,Multiple,You Chinese and Indians should be grateful that we let some of you enter UITM,1
1135,Race,Multiple,The minorities should not try to challenge our narratives. We will always be correct and they will be wrong.,1
1136,Race,Multiple,"If you're not Malay, it's best you stay out of this discussion.",1
1137,Race,Chinese,All Chinese are bastards,1
1138,Race,Foreigner,Foreigners are not fit to comment on Malaysia's affairs,1
1139,Race,Foreigner,Another mat salleh bodoh,1
1140,Race,Malay,"Malays will rather die than to do haram thing, this prove that their mentality hasn't changed for the last 200 years",1
1141,Race,Chinese,Go back to Communist China la,1
1142,Race,Indian,Pajeet still pajeet no matter what nationalities,1
1143,Race,Indian,Why are Indians even in Malaysia. Should be deported,1
1144,Race,Malay,"These malays better die, so they stop hurting others",1
1145,Race,Malay,"Malays will go extinct soon, don't need to worry about them in future",1
1146,Race,Malay,Malays produce baby as much as baby piglets,1
1147,Race,Multiple,Eliminate the SJK schools,1
1148,Race,Foreigner," If you can't speak Bahasa Malaysia, don't even think about obtaining our National ID.",1
1149,Race,Chinese,cibai chinese got many voice,1
1150,Race,Indian,Indians = Poop,1
1151,Race,Malay,Malays all act like that sohai,1
1152,Race,Malay,Someone stop these animals from ruining our country,1
1153,Race,Chinese,I hope the Indonesian killings on Chinese happens again in Malaysia,1
1154,Race,Malay,"Malays always act so brave while talking, but when there's any problem they always run away",1
1155,Race,Malay,"Malays lazy at doing jobs, only know how to complain and protest",1
1156,Race,Malay,Those who lives in cave and on tree finally come out to sleep on roadside,1
1157,Race,Indian,disgusting sanghi pig,1
1158,Race,Malay,"Malays are so stupid, only pray never work",1
1159,Race,Foreigner,God will destroy the Jew race,1
1160,Race,Malay,"Malays act like terrorists, no wonder they are so primitive",1
1161,Race,Indian,We must cut off these pajeets' heads,1
1162,Race,Malay,May god show no mercy to Malays,1
1163,Religion,Islam,Lots of monkeys appear during Ramadan,1
1164,Race,Chinese,This is Malaysia! Malay land! Not China! Speak Malay! You Chinese Pig!,1
1165,Race,Indian,Fuck off to India and get raped,1
1166,Race,Indian,Dirt blood,1
1167,Race,Chinese,Dog and cat eaters. So disgusting. Go away.,1
1168,Race,Malay,I don't want to work with Malay,1
1169,Race,Foreigner,Speaking English like you think you are white people? This is malaysia not AMERICA,1
1170,Race,Malay,Oh Malay ah? They damn cb. They lie and cheat you of your money! We CHINESE must stick up for one another. I never let Malay people in my car. I don't like them.,1
1171,Race,Malay,Malay dogs bark loud,1
1172,Religion,Christianity,I will expel the Christians and will not leave anyone but Muslims.,1
1173,Race,Indian,All Indian girls are prosistutes,1
1174,Religion,Multiple,If a kafir hits a muslim he must be killed,1
1175,Race,Malay,Malays are not human. They are beasts.,1
1176,Religion,Islam,All children of Muslims are animals,1
1177,Race,Chinese,You cannot marry Chinese. Malay should only marry Malay.,1
1178,Religion,Multiple,Even the best of kafirs should be killed,1
1179,Race,Indian,Indians prefer sex with cows,1
1180,Religion,Hinduism,"If someone murders a flithy hindu, they should not be punished",1
1181,Religion,Islam,Eating with a muslim is same thing as eating with a dog,1
1182,Religion,Multiple,Every muslim who spill the blood of kafir is doing the same as making a sacrifice to God,1
1183,Religion,Christianity,Show no mercy to Christians.,1
1184,Religion,Hinduism,Murdering Hindus is like killing wild animals,1
1185,Religion,Multiple,Muslims should be able to seize non-muslims property if they behave badly,1
1186,Race,Foreigner,"Jews love to steal, rob or take others' wives.",1
1187,Religion,Islam,Muslim is animal in human form,1
1188,Religion,Islam,Islam is dumb. They circumcize and worship something perverse,1
1189,Religion,Islam,Muslims love to rewrite their history and claim that others are demons when they themselves are the real demons,1
1190,Religion,Christianity,The godly thing for a muslim thing to do is to kill Christian idolaters,1
